{"aliyun_runtime_identity_sha256":"PENDING_FREEZE","api_surface":"chat.completions.create","base_url":"https://open.bigmodel.cn/api/paas/v4","concurrency":1,"egress_allowlist":"open.bigmodel.cn:443","executable_code_commit_sha":"PENDING_EXECUTABLE_COMMIT","executable_source_sha256":"3c26e2779803952af69d6426b813d44a439ab2e6b3d815c5afa2b6e76994701d","immutable_image_digest":"PENDING_FREEZE","local_persistence":{"credential_value_retention":false,"deterministic_synthetic_source_manifest_retention":true,"exception_message_retention":false,"raw_provider_response_retention":false,"raw_tool_args_results_retention":false,"rendered_raw_prompt_retention":false,"rendered_synthetic_diff_retention":false,"safe_hash_enum_boolean_count_receipt_retention":true},"openai_sdk_version":"2.46.0","paid_calls_enabled":false,"phase_id":"phase11c-provider-canary-v1","provider":"glm","proxy_policy":"deny_implicit_inheritance","publisher_mode":"fake_dry_run","real_provider_calls_enabled":false,"redirect_policy":"deny","rendered_deployment_config_sha256":"PENDING_FREEZE","request_model_id":"glm-5.2","runtime_config_sha256":"f64ab347e85acb429d33e2935afac1da9f90ec44170a3776e288cc10c4b60d69","schema_version":"phase11c-provider-canary-runtime/v1","sdk_package_set_sha256":"912958897684d6e6071a23a2eb3af9f168ea725c48af350403ae66b6c203d304","sdk_retries":0,"snapshot_immutability":false,"source_archive_sha256":"PENDING_FREEZE","tls_certificate_verification":true,"transport_retries":0}
